{"curve":{"points":[{"cost":0.7,"fn":0,"fp":175,"t":0.0,"tn":0,"tp":75},{"cost":0.7,"fn":0,"fp":175,"t":0.01,"tn":0,"tp":75},{"cost":0.692,"fn":0,"fp":173,"t":0.02,"tn":2,"tp":75},{"cost":0.664,"fn":0,"fp":166,"t":0.03,"tn":9,"tp":75},{"cost":0.648,"fn":0,"fp":162,"t":0.04,"tn":13,"tp":75},{"cost":0.628,"fn":0,"fp":157,"t":0.05,"tn":18,"tp":75},{"cost":0.62,"fn":1,"fp":150,"t":0.06,"tn":25,"tp":74},{"cost":0.608,"fn":2,"fp":142,"t":0.07,"tn":33,"tp":73},{"cost":0.612,"fn":3,"fp":138,"t":0.08,"tn":37,"tp":72},{"cost":0.6,"fn":4,"fp":130,"t":0.09,"tn":45,"tp":71},{"cost":0.576,"fn":4,"fp":124,"t":0.1,"tn":51,"tp":71},{"cost":0.6,"fn":6,"fp":120,"t":0.11,"tn":55,"tp":69},{"cost":0.58,"fn":6,"fp":115,"t":0.12,"tn":60,"tp":69},{"cost":0.608,"fn":8,"fp":112,"t":0.13,"tn":63,"tp":67},{"cost":0.628,"fn":10,"fp":107,"t":0.14,"tn":68,"tp":65},{"cost":0.596,"fn":10,"fp":99,"t":0.15,"tn":76,"tp":65},{"cost":0.62,"fn":12,"fp":95,"t":0.16,"tn":80,"tp":63},{"cost":0.604,"fn":12,"fp":91,"t":0.17,"tn":84,"tp":63},{"cost":0.6,"fn":12,"fp":90,"t":0.18,"tn":85,"tp":63},{"cost":0.592,"fn":12,"fp":88,"t":0.19,"tn":87,"tp":63},{"cost":0.588,"fn":13,"fp":82,"t":0.2,"tn":93,"tp":62},{"cost":0.584,"fn":14,"fp":76,"t":0.21,"tn":99,"tp":61},{"cost":0.576,"fn":14,"fp":74,"t":0.22,"tn":101,"tp":61},{"cost":0.62,"fn":17,"fp":70,"t":0.23,"tn":105,"tp":58},{"cost":0.652,"fn":19,"fp":68,"t":0.24,"tn":107,"tp":56},{"cost":0.66,"fn":20,"fp":65,"t":0.25,"tn":110,"tp":55},{"cost":0.688,"fn":22,"fp":62,"t":0.26,"tn":113,"tp":53},{"cost":0.668,"fn":22,"fp":57,"t":0.27,"tn":118,"tp":53},{"cost":0.688,"fn":23,"fp":57,"t":0.28,"tn":118,"tp":52},{"cost":0.704,"fn":24,"fp":56,"t":0.29,"tn":119,"tp":51},{"cost":0.688,"fn":24,"fp":52,"t":0.3,"tn":123,"tp":51},{"cost":0.688,"fn":24,"fp":52,"t":0.31,"tn":123,"tp":51},{"cost":0.736,"fn":27,"fp":49,"t":0.32,"tn":126,"tp":48},{"cost":0.772,"fn":29,"fp":48,"t":0.33,"tn":127,"tp":46},{"cost":0.796,"fn":31,"fp":44,"t":0.34,"tn":131,"tp":44},{"cost":0.804,"fn":32,"fp":41,"t":0.35,"tn":134,"tp":43},{"cost":0.84,"fn":34,"fp":40,"t":0.36,"tn":135,"tp":41},{"cost":0.836,"fn":34,"fp":39,"t":0.37,"tn":136,"tp":41},{"cost":0.848,"fn":35,"fp":37,"t":0.38,"tn":138,"tp":40},{"cost":0.868,"fn":36,"fp":37,"t":0.39,"tn":138,"tp":39},{"cost":0.904,"fn":38,"fp":36,"t":0.4,"tn":139,"tp":37},{"cost":0.908,"fn":39,"fp":32,"t":0.41,"tn":143,"tp":36},{"cost":0.924,"fn":40,"fp":31,"t":0.42,"tn":144,"tp":35},{"cost":0.956,"fn":42,"fp":29,"t":0.43,"tn":146,"tp":33},{"cost":0.972,"fn":43,"fp":28,"t":0.44,"tn":147,"tp":32},{"cost":1.004,"fn":45,"fp":26,"t":0.45,"tn":149,"tp":30},{"cost":1.0,"fn":45,"fp":25,"t":0.46,"tn":150,"tp":30},{"cost":1.06,"fn":48,"fp":25,"t":0.47,"tn":150,"tp":27},{"cost":1.068,"fn":49,"fp":22,"t":0.48,"tn":153,"tp":26},{"cost":1.084,"fn":50,"fp":21,"t":0.49,"tn":154,"tp":25},{"cost":1.092,"fn":51,"fp":18,"t":0.5,"tn":157,"tp":24},{"cost":1.088,"fn":51,"fp":17,"t":0.51,"tn":158,"tp":24},{"cost":1.088,"fn":51,"fp":17,"t":0.52,"tn":158,"tp":24},{"cost":1.12,"fn":53,"fp":15,"t":0.53,"tn":160,"tp":22},{"cost":1.14,"fn":54,"fp":15,"t":0.54,"tn":160,"tp":21},{"cost":1.16,"fn":55,"fp":15,"t":0.55,"tn":160,"tp":20},{"cost":1.196,"fn":57,"fp":14,"t":0.56,"tn":161,"tp":18},{"cost":1.192,"fn":57,"fp":13,"t":0.57,"tn":162,"tp":18},{"cost":1.232,"fn":59,"fp":13,"t":0.58,"tn":162,"tp":16},{"cost":1.252,"fn":60,"fp":13,"t":0.59,"tn":162,"tp":15},{"cost":1.248,"fn":60,"fp":12,"t":0.6,"tn":163,"tp":15},{"cost":1.268,"fn":61,"fp":12,"t":0.61,"tn":163,"tp":14},{"cost":1.284,"fn":62,"fp":11,"t":0.62,"tn":164,"tp":13},{"cost":1.3,"fn":63,"fp":10,"t":0.63,"tn":165,"tp":12},{"cost":1.316,"fn":64,"fp":9,"t":0.64,"tn":166,"tp":11},{"cost":1.336,"fn":65,"fp":9,"t":0.65,"tn":166,"tp":10},{"cost":1.376,"fn":67,"fp":9,"t":0.66,"tn":166,"tp":8},{"cost":1.376,"fn":67,"fp":9,"t":0.67,"tn":166,"tp":8},{"cost":1.372,"fn":67,"fp":8,"t":0.68,"tn":167,"tp":8},{"cost":1.372,"fn":67,"fp":8,"t":0.69,"tn":167,"tp":8},{"cost":1.388,"fn":68,"fp":7,"t":0.7,"tn":168,"tp":7},{"cost":1.388,"fn":68,"fp":7,"t":0.71,"tn":168,"tp":7},{"cost":1.388,"fn":68,"fp":7,"t":0.72,"tn":168,"tp":7},{"cost":1.404,"fn":69,"fp":6,"t":0.73,"tn":169,"tp":6},{"cost":1.412,"fn":70,"fp":3,"t":0.74,"tn":172,"tp":5},{"cost":1.412,"fn":70,"fp":3,"t":0.75,"tn":172,"tp":5},{"cost":1.412,"fn":70,"fp":3,"t":0.76,"tn":172,"tp":5},{"cost":1.424,"fn":71,"fp":1,"t":0.77,"tn":174,"tp":4},{"cost":1.444,"fn":72,"fp":1,"t":0.78,"tn":174,"tp":3},{"cost":1.464,"fn":73,"fp":1,"t":0.79,"tn":174,"tp":2},{"cost":1.464,"fn":73,"fp":1,"t":0.8,"tn":174,"tp":2},{"cost":1.484,"fn":74,"fp":1,"t":0.81,"tn":174,"tp":1},{"cost":1.484,"fn":74,"fp":1,"t":0.82,"tn":174,"tp":1},{"cost":1.484,"fn":74,"fp":1,"t":0.83,"tn":174,"tp":1},{"cost":1.484,"fn":74,"fp":1,"t":0.84,"tn":174,"tp":1},{"cost":1.504,"fn":75,"fp":1,"t":0.85,"tn":174,"tp":0},{"cost":1.504,"fn":75,"fp":1,"t":0.86,"tn":174,"tp":0},{"cost":1.504,"fn":75,"fp":1,"t":0.87,"tn":174,"tp":0},{"cost":1.504,"fn":75,"fp":1,"t":0.88,"tn":174,"tp":0},{"cost":1.504,"fn":75,"fp":1,"t":0.89,"tn":174,"tp":0},{"cost":1.5,"fn":75,"fp":0,"t":0.9,"tn":175,"tp":0},{"cost":1.5,"fn":75,"fp":0,"t":0.91,"tn":175,"tp":0},{"cost":1.5,"fn":75,"fp":0,"t":0.92,"tn":175,"tp":0},{"cost":1.5,"fn":75,"fp":0,"t":0.93,"tn":175,"tp":0},{"cost":1.5,"fn":75,"fp":0,"t":0.94,"tn":175,"tp":0},{"cost":1.5,"fn":75,"fp":0,"t":0.95,"tn":175,"tp":0},{"cost":1.5,"fn":75,"fp":0,"t":0.96,"tn":175,"tp":0},{"cost":1.5,"fn":75,"fp":0,"t":0.97,"tn":175,"tp":0},{"cost":1.5,"fn":75,"fp":0,"t":0.98,"tn":175,"tp":0},{"cost":1.5,"fn":75,"fp":0,"t":0.99,"tn":175,"tp":0},{"cost":1.5,"fn":75,"fp":0,"t":1.0,"tn":175,"tp":0}],"thresholds":[0.0,0.01,0.02,0.03,0.04,0.05,0.06,0.07,0.08,0.09,0.1,0.11,0.12,0.13,0.14,0.15,0.16,0.17,0.18,0.19,0.2,0.21,0.22,0.23,0.24,0.25,0.26,0.27,0.28,0.29,0.3,0.31,0.32,0.33,0.34,0.35,0.36,0.37,0.38,0.39,0.4,0.41,0.42,0.43,0.44,0.45,0.46,0.47,0.48,0.49,0.5,0.51,0.52,0.53,0.54,0.55,0.56,0.57,0.58,0.59,0.6,0.61,0.62,0.63,0.64,0.65,0.66,0.67,0.68,0.69,0.7,0.71,0.72,0.73,0.74,0.75,0.76,0.77,0.78,0.79,0.8,0.81,0.82,0.83,0.84,0.85,0.86,0.87,0.88,0.89,0.9,0.91,0.92,0.93,0.94,0.95,0.96,0.97,0.98,0.99,1.0]},"dataset":{"bad_rate":0.3,"doi":"10.24432/C5NC77","licence":"CC BY 4.0","name":"Statlog German Credit","rows":1000,"split":{"cal":150,"test":250,"train":600},"split_seed":20261011},"generated_at":"2026-10-11T00:00:00Z","model":{"metrics_test_calibrated":{"auc":0.736457,"brier":0.184374,"log_loss":0.545334},"metrics_test_raw":{"auc":0.736457,"brier":0.183764,"log_loss":0.54322},"n_features":55,"platt":{"a":1.04254617,"b":-0.05850126},"type":"logistic regression (L2, C=0.1) on 7 standardized numerics + one-hot categoricals, then Platt scaling on the calibration split"},"optimum":{"bootstrap_cost_0_5_minus_1_6":{"ci95":[0.2679,0.7401],"mean":0.490892,"n":1000,"share_1_6_better":1.0},"cost_at_0_5":1.092,"cost_at_theory":0.604,"cost_opt":0.576,"saving_vs_0_5":0.516,"t_opt_grid":0.1,"t_theory":0.1666666667},"reliability":{"bins":[{"mean_pred":0.056111,"n":50,"obs_rate":0.08},{"mean_pred":0.134134,"n":50,"obs_rate":0.16},{"mean_pred":0.242371,"n":50,"obs_rate":0.26},{"mean_pred":0.388668,"n":50,"obs_rate":0.48},{"mean_pred":0.626018,"n":50,"obs_rate":0.52}]},"repeated_splits":{"mean_cost_05":0.943733,"mean_cost_1_6":0.5604,"mean_cost_opt":0.522133,"n":30,"runs":[{"cost_05":0.956,"cost_1_6":0.616,"cost_opt":0.556,"seed":20261111,"t_opt":0.07},{"cost_05":0.992,"cost_1_6":0.452,"cost_opt":0.436,"seed":20261112,"t_opt":0.17},{"cost_05":0.836,"cost_1_6":0.544,"cost_opt":0.464,"seed":20261113,"t_opt":0.26},{"cost_05":0.98,"cost_1_6":0.536,"cost_opt":0.476,"seed":20261114,"t_opt":0.11},{"cost_05":0.804,"cost_1_6":0.568,"cost_opt":0.504,"seed":20261115,"t_opt":0.22},{"cost_05":0.9,"cost_1_6":0.552,"cost_opt":0.56,"seed":20261116,"t_opt":0.15},{"cost_05":0.952,"cost_1_6":0.532,"cost_opt":0.512,"seed":20261117,"t_opt":0.1},{"cost_05":0.956,"cost_1_6":0.628,"cost_opt":0.564,"seed":20261118,"t_opt":0.08},{"cost_05":0.972,"cost_1_6":0.6,"cost_opt":0.548,"seed":20261119,"t_opt":0.13},{"cost_05":1.04,"cost_1_6":0.628,"cost_opt":0.6,"seed":20261120,"t_opt":0.21},{"cost_05":1.016,"cost_1_6":0.484,"cost_opt":0.468,"seed":20261121,"t_opt":0.17},{"cost_05":0.908,"cost_1_6":0.54,"cost_opt":0.516,"seed":20261122,"t_opt":0.13},{"cost_05":0.904,"cost_1_6":0.56,"cost_opt":0.536,"seed":20261123,"t_opt":0.14},{"cost_05":0.948,"cost_1_6":0.5,"cost_opt":0.496,"seed":20261124,"t_opt":0.15},{"cost_05":1.044,"cost_1_6":0.616,"cost_opt":0.552,"seed":20261125,"t_opt":0.12},{"cost_05":0.84,"cost_1_6":0.624,"cost_opt":0.544,"seed":20261126,"t_opt":0.24},{"cost_05":0.856,"cost_1_6":0.472,"cost_opt":0.476,"seed":20261127,"t_opt":0.17},{"cost_05":0.868,"cost_1_6":0.552,"cost_opt":0.544,"seed":20261128,"t_opt":0.16},{"cost_05":0.96,"cost_1_6":0.572,"cost_opt":0.484,"seed":20261129,"t_opt":0.09},{"cost_05":0.976,"cost_1_6":0.588,"cost_opt":0.548,"seed":20261130,"t_opt":0.2},{"cost_05":1.152,"cost_1_6":0.58,"cost_opt":0.564,"seed":20261131,"t_opt":0.16},{"cost_05":0.928,"cost_1_6":0.564,"cost_opt":0.56,"seed":20261132,"t_opt":0.17},{"cost_05":0.896,"cost_1_6":0.572,"cost_opt":0.536,"seed":20261133,"t_opt":0.23},{"cost_05":0.992,"cost_1_6":0.548,"cost_opt":0.524,"seed":20261134,"t_opt":0.24},{"cost_05":1.004,"cost_1_6":0.504,"cost_opt":0.516,"seed":20261135,"t_opt":0.16},{"cost_05":0.864,"cost_1_6":0.576,"cost_opt":0.508,"seed":20261136,"t_opt":0.33},{"cost_05":0.948,"cost_1_6":0.628,"cost_opt":0.52,"seed":20261137,"t_opt":0.07},{"cost_05":1.128,"cost_1_6":0.572,"cost_opt":0.56,"seed":20261138,"t_opt":0.18},{"cost_05":0.908,"cost_1_6":0.516,"cost_opt":0.46,"seed":20261139,"t_opt":0.23},{"cost_05":0.784,"cost_1_6":0.588,"cost_opt":0.532,"seed":20261140,"t_opt":0.12}],"t_opt_iqr":[0.1225,0.2075],"t_opt_median":0.16,"t_opt_min_max":[0.07,0.33]},"schema_version":"v1","spec":{"cost_matrix":{"bad_accepted":5,"good_rejected":1,"source":"UCI Statlog German Credit, published"},"excluded_features":["personal_status (encodes sex)","foreign_worker"],"rule"